{
  "schemaVersion": "1.0",
  "tool": "atelier/runtime-ux-audit",
  "url": "index.html",
  "timestamp": "2026-01-01T00:00:00.000Z",
  "mode": {
    "dynamic": false,
    "areas": [
      "panels"
    ],
    "engine": null
  },
  "budgets": {
    "minTapPx": 24,
    "minTapPxSource": "default",
    "inpBudgetMs": 200,
    "lcpBudgetMs": 2500,
    "clsBudget": 0.1,
    "zIndexMax": 50,
    "longScriptMs": 100,
    "motionDurationsMs": {
      "long": 400,
      "medium": 250,
      "short": 150
    }
  },
  "summary": {
    "pass": false,
    "rules": {
      "critical": 0,
      "serious": 5,
      "moderate": 9,
      "minor": 9
    },
    "instances": {
      "critical": 0,
      "serious": 6,
      "moderate": 11,
      "minor": 11
    },
    "byArea": {
      "panels": {
        "critical": 0,
        "serious": 5,
        "moderate": 9,
        "minor": 9,
        "instances": 28
      }
    }
  },
  "metrics": {
    "inpP75Ms": null,
    "inp": null,
    "bfcache": null,
    "highlights": {
      "panels": {
        "z-index smells": 3,
        "dialog semantics": 7,
        "popover/menu behavior": 5,
        "motion gaps": 5,
        "compositor costs": 3
      }
    }
  },
  "violations": [
    {
      "ruleId": "atelier/runtime-ux/backdrop-filter-on-video-modal",
      "severity": "serious",
      "area": "panels",
      "confidence": "high",
      "methods": [
        "css",
        "html"
      ],
      "description": "backdrop-filter on a modal that contains a video or iframe, which re-runs the blur on every video frame.",
      "helpUrl": "https://developer.mozilla.org/en-US/docs/Web/CSS/backdrop-filter",
      "nodes": [
        {
          "selector": "dialog.trailer",
          "snippet": "dialog.trailer { backdrop-filter: blur(8px) }",
          "location": "css/panels.css:42:18",
          "message": "backdrop-filter on a modal that holds <video> or <iframe> (#trailer); the blur re-runs every frame",
          "data": {
            "containers": [
              "#trailer"
            ]
          }
        }
      ]
    },
    {
      "ruleId": "atelier/runtime-ux/destructive-dialog-closedby-any",
      "severity": "serious",
      "area": "panels",
      "confidence": "medium",
      "methods": [
        "html"
      ],
      "description": "A destructive confirmation <dialog> uses closedby=\"any\", so a stray click outside dismisses it.",
      "helpUrl": "https://html.spec.whatwg.org/multipage/interactive-elements.html#attr-dialog-closedby",
      "nodes": [
        {
          "selector": "#confirm-delete",
          "snippet": "<dialog id=\"confirm-delete\" closedby=\"any\" aria-labelledby=\"confirm-title\">",
          "location": "index.html:50:29",
          "message": "closedby=\"any\" on a \"delete\" confirmation; use closedby=\"closerequest\" so only Escape or a button closes it"
        }
      ]
    },
    {
      "ruleId": "atelier/runtime-ux/dialog-missing-label",
      "severity": "serious",
      "area": "panels",
      "confidence": "high",
      "methods": [
        "html"
      ],
      "description": "A <dialog> has no accessible name (aria-label, aria-labelledby or title), so screen readers announce it without a title.",
      "helpUrl": "https://www.w3.org/WAI/ARIA/apg/patterns/dialog-modal/",
      "nodes": [
        {
          "selector": "#settings",
          "snippet": "<dialog id=\"settings\">",
          "location": "index.html:45:1",
          "message": "no aria-labelledby, aria-label or title; point aria-labelledby at the dialog heading"
        }
      ]
    },
    {
      "ruleId": "atelier/runtime-ux/menu-no-arrow-keys",
      "severity": "serious",
      "area": "panels",
      "confidence": "medium",
      "methods": [
        "js",
        "html"
      ],
      "description": "role=\"menu\" or \"menubar\" promises arrow-key navigation, but no script handles ArrowUp or ArrowDown.",
      "helpUrl": "https://www.w3.org/WAI/ARIA/apg/patterns/menubar/",
      "nodes": [
        {
          "selector": "#menu-pop",
          "snippet": "<div id=\"menu-pop\" class=\"dropdown\" popover role=\"menu\">",
          "location": "index.html:27:47",
          "message": "role=\"menu\" but no keydown handler for ArrowUp/ArrowDown"
        }
      ]
    },
    {
      "ruleId": "atelier/runtime-ux/tooltip-focusable",
      "severity": "serious",
      "area": "panels",
      "confidence": "high",
      "methods": [
        "html",
        "js"
      ],
      "description": "A role=\"tooltip\" element can take focus or receives focus from a script; tooltips must never be focused.",
      "helpUrl": "https://www.w3.org/WAI/ARIA/apg/patterns/tooltip/",
      "nodes": [
        {
          "selector": "#info-tip",
          "snippet": "<div id=\"info-tip\" role=\"tooltip\" tabindex=\"0\">",
          "location": "index.html:33:37",
          "message": "role=\"tooltip\" element is focusable (tabindex=\"0\")"
        },
        {
          "selector": "script[src=\"js/panels.js\"]",
          "snippet": "document.getElementById('info-tip').focus()",
          "location": "js/panels.js:40:3",
          "message": "focus() moves focus into role=\"tooltip\" element #info-tip"
        }
      ]
    },
    {
      "ruleId": "atelier/runtime-ux/anchor-name-no-supports",
      "severity": "moderate",
      "area": "panels",
      "confidence": "high",
      "methods": [
        "css",
        "html"
      ],
      "description": "Anchor positioning is used outside @supports and without a polyfill, so browsers without it show an unanchored panel.",
      "helpUrl": "https://developer.mozilla.org/en-US/docs/Web/CSS/CSS_anchor_positioning",
      "nodes": [
        {
          "selector": ".tip-anchor",
          "snippet": ".tip-anchor { anchor-name: --tip }",
          "location": "index.html:10:15",
          "message": "anchor-name outside @supports (anchor-name: --a) and no polyfill; add a fallback position for older browsers"
        },
        {
          "selector": ".flyout-pos",
          "snippet": ".flyout-pos { position-anchor: --tip }",
          "location": "index.html:14:15",
          "message": "position-anchor outside @supports (anchor-name: --a) and no polyfill; add a fallback position for older browsers"
        }
      ]
    },
    {
      "ruleId": "atelier/runtime-ux/backdrop-as-sibling-div",
      "severity": "moderate",
      "area": "panels",
      "confidence": "medium",
      "methods": [
        "html"
      ],
      "description": "A hand-made backdrop element sits next to or around a modal; a modal <dialog> gets ::backdrop for free.",
      "helpUrl": "https://developer.mozilla.org/en-US/docs/Web/CSS/::backdrop",
      "nodes": [
        {
          "selector": "body > div.modal-backdrop:nth-of-type(1)",
          "snippet": "<div class=\"modal-backdrop\">",
          "location": "index.html:64:1",
          "message": "\".modal-backdrop\" backs modal body > div.modal:nth-of-type(3); style dialog::backdrop instead"
        }
      ]
    },
    {
      "ruleId": "atelier/runtime-ux/backdrop-filter-on-opaque-fill",
      "severity": "moderate",
      "area": "panels",
      "confidence": "high",
      "methods": [
        "css"
      ],
      "description": "backdrop-filter sits behind a fill that is at least 90% opaque, so the blur is invisible but still costs a compositor layer.",
      "helpUrl": "https://developer.mozilla.org/en-US/docs/Web/CSS/backdrop-filter",
      "nodes": [
        {
          "selector": ".site-nav",
          "snippet": ".site-nav { backdrop-filter: blur(16px) }",
          "location": "css/panels.css:15:3",
          "message": "backdrop-filter: blur(16px) over background: rgba(10, 10, 15, 0.96) (alpha 0.96); the blur cannot show through, drop it",
          "data": {
            "alpha": 0.96,
            "fill": "rgba(10, 10, 15, 0.96)"
          }
        }
      ]
    },
    {
      "ruleId": "atelier/runtime-ux/custom-outside-click-on-auto-popover",
      "severity": "moderate",
      "area": "panels",
      "confidence": "medium",
      "methods": [
        "js",
        "html"
      ],
      "description": "A page-level click listener closes popovers by hand although popover=\"auto\" already light-dismisses.",
      "helpUrl": "https://developer.mozilla.org/en-US/docs/Web/API/Popover_API",
      "nodes": [
        {
          "selector": "script[src=\"js/panels.js\"]",
          "snippet": "document.addEventListener('click', (event) => { const menu = document.getElementById('menu-pop'); if (!menu.contains(event.target)) menu.hidePopover(); })",
          "location": "js/panels.js:28:1",
          "message": "document click listener dismisses popovers by hand; popover=\"auto\" already closes on an outside click"
        }
      ]
    },
    {
      "ruleId": "atelier/runtime-ux/div-role-dialog",
      "severity": "moderate",
      "area": "panels",
      "confidence": "medium",
      "methods": [
        "html"
      ],
      "description": "A modal built from a non-dialog element with role=\"dialog\"; a native <dialog> opened with showModal() handles focus, inertness and Escape.",
      "helpUrl": "https://developer.mozilla.org/en-US/docs/Web/HTML/Element/dialog",
      "nodes": [
        {
          "selector": "body > div.modal:nth-of-type(3)",
          "snippet": "<div class=\"modal\" role=\"dialog\" aria-modal=\"true\" aria-labelledby=\"legacy-title\">",
          "location": "index.html:66:20",
          "message": "<div role=\"dialog\" aria-modal=\"true\">: use <dialog> with showModal()"
        }
      ]
    },
    {
      "ruleId": "atelier/runtime-ux/fixed-nav-backdrop-filter-under-modal",
      "severity": "moderate",
      "area": "panels",
      "confidence": "medium",
      "methods": [
        "css",
        "html"
      ],
      "description": "A fixed element keeps its backdrop-filter while a modal covers it, so the blur is recomputed under the modal on every paint.",